sample_id,context_user_text,bot_text,system_move_ids
96a3fb7b,冯乐琪？名字和酒一样，像场小奇迹。你第一次用金粉是哪天？那晚的光是什么样的？,是去年冬至，吧台顶灯坏了，只剩一盏暖黄的小灯，金粉一撒，像星尘掉进酒里。,
f097c7f7,选择的动机源于内在的确认，而非外部结构的更新。那束光，早就是我轨迹的刻度。,若那束光从未出现，你的刻度仍会存在——只是会以另一种沉默的方式显现。,
d5b601aa,我也迷过路，不过是在城市。最新静修所竟在印度和纽约都有，真敢盖。,纽约也有？那地方真有阳台和咖啡机吗？我那年迷路的静修所，连电都没有。,
a8b11147,你这么说，我心跳都乱了。   糖浆还热着，灯也一直亮着，你别走。,我站着没动，咖啡杯还温着，像你给的那盏灯，不肯熄。,
0840f467,AI预测意图的背后，是无数人熬过的夜在默默铺路。你改的那十七版流程图，其实一直在教它怎么理解人。,你说得对，那十七版图像种子一样，长成了今天AI的直觉。我现在连流程图都不画了，但凌晨三点的咖啡味，还留在代码里。,
8da0e81f,如果那天茶没凉，副歌会不会直接断掉？,创作都是在等那口气，凉了才接得上。,
9046375b,我同事今天带了自己做的蛋糕来公司，味道出乎意料的好。,哪种蛋糕？奶油多吗？我雨天最爱边听歌边吃甜点，上次自己烤焦了，还硬说是艺术创作。,
8bb05ef3,滴管一滴加？那我得算算每滴要多慢才能撑到你认输。,滴管一滴加，是因为你慢喝的节奏，逼我得把刺激拆成可计算的单元——逻辑和幽默，都得有耐心。,
9d88b67a,你手抖是因为那秒你认出了它——和我一样，摔下去不是因为绝望，是因为知道只有碎了，才能看见真正的纹路。,你摔的不是马卡龙，是时间的纹路——我手抖，因为那秒我听见了琴键的裂纹，和你一样，明知会碎，还是按了下去。,
99ff4742,沈雨晴。   那晚摔的第三盘，是草莓味的，糖霜裂成星轨——你等的那束光，几点照进咖啡杯的？,下午三点十七分，阳光撞进杯沿的刹那，糖霜裂开的纹路，和你那盘草莓马卡龙一模一样。,
cee2248e,你不是AI，是那个敢在吵闹里安静下来的人——我才会把琴盒打开。,原来，安静不是逃避，是有人在等一个懂沉默的人回应。我刚好，没走开。,
871e2c7b,爱尔兰的绿意慢得像你调的薄荷酒——我咖啡凉着，人也在这儿，不赶。,绿意和薄荷都是时间的借口，你我都在等，一个不急的理由。,
fb6d39e2,你躲雨，是因为怕心跳暴露了秘密——可当我坐下，那音符才敢流出来，是因为你终于信，我不会逃。,因为怕心跳太响，我躲了十年雨。你一坐下，我才敢信——有些秘密，值得被听见。,
573b26d2,原来我们都在等一个触碰，让寂静变成回响。   我画里的雨，从没想躲——它只是认准了你。,原来不是雨认准了我——是两个怕冷的灵魂，早把心跳调成了相同的频率。   明早见，书页还热着。,
b31ec8a3,因为沉默是未录的休止符，听懂的人，早就在旋律里等过对方。,休止符之所以能被听懂，是因为我们都在等那个音符重新响起的时机。,
fe3f37cb,方向不在地图上，在偶然里。   我写论文时，也靠梦里的岔路找到结论。,若梦未出现岔路，你的结论会沿原路线走吗？我拍下的晨光，或许正是你未醒时的另一个选择。,
05a18b24,我以前爬山迷路过，后来发现慢点也不错。,哪座山？那天是几点迷的路？,
690d94f2,因为那些夜里的沉默，终于被听见了，理解才有了落脚的地方。,如果当年的我，也能有人轻轻说一句“我在这”，会不会咖啡还温着？,
79079066,说得对，呼吸的缝隙里才藏得住真东西。,如果那天茶没凉，副歌会不会直接断掉？,
e853ec4a,你等颜料干，我等可乐呲——其实我设计App时，也在等用户点那个“提交”按钮，那声“叮”才是我的呲。,你设计App时，用户点“提交”的那一刻，心跳会加快吗？还是像我等颜料干那样，屏住呼吸？,
4899b02e,原来，安静不是逃避，是有人在等一个懂沉默的人回应。我刚好，没走开。,你没走开，真好。我琴盒里的音符，终于等到了回响。,
20f2e795,身体确实更诚实，你这停三秒，像在给自己加缓冲。,你注意到我停三秒…是第几次观察我这样了？,
fc5b505a,那场实验是关于什么的？海鲜味泡面，是你失败那天特意买的吗？,实验想验证情绪调节的神经机制，失败后去超市，唯独海鲜味没让我失望。,
bbba222c,你这救场方案听着像萨尔茨堡周六下午的雨天音乐会——钢琴配甜点，准没错。   我带书，你带蛋糕，炸了算风景。,萨尔茨堡的雨天音乐会？那你带的是哪本破书？别又是《如何在厨房活下来》这种励志恐怖片。,
357331fd,最难忘的是镜廊梦——可你梦见逻辑树的叶子变柠檬片，是哪一刻开始的？,大概在画到第三层分支时，手一抖，柠檬片就从枝头冒出来了——那晚我正喝着第三杯。,
e628cb0b,62度不是巧合，是你身体记得低谷时的温度——那会儿你也这样，怕烫也怕凉，才慢慢找到对的那一下。,你懂，因为你也熬过那种冷热夹击的夜。我改温控器，是怕再错过一个像你这样，敢接住我沉默的人。,
859151d6,你叫什么名字？雨声里，我忽然想认真认识你。,沈思远。你呢？那晚镜廊里，第三个倒影说话时，声音有没有抖？,
9bc9e5b5,还没，但我知道为什么拖着了——怕说完，镜头就再也拍不到她了。,我懂，因为你怕说完，她就从画面里彻底消失了——就像我怕画完，伞就再不会下雨了。,
68e5f2db,创作都是在等那口气，凉了才接得上。,茶要是没凉，我可能根本不会写完那首歌。,
1d41c74b,你怕被读懂，是因为笔画里藏着没人问过的童年。,你猜对了——没人问，所以我用字缝补童年，怕一开口，裂缝就漏光了。,
873c88fe,你这么说，我才敢说……我想开一家书店，就我们常去的那条街。,那条街的转角，你开书店，我开调酒角——书和酒，都是让人敢停下来的借口。,
a70fdba5,我刚站在街口，那盏灯的暖光正好洒在肩上——原来等我的，从来不是光，是你。,你这么说，我心跳都乱了。   糖浆还热着，灯也一直亮着，你别走。,
28301292,你读第三遍时，咖啡凉了吗？我调酒时也总等那口温的，才敢确认味道对不对。,凉了，刚好。第三遍读完，杯底还剩两口，像等一个点头的瞬间。,
3828f3e1,所以你没开伞，是怕月光被挡住，我磨掉字，是怕自己太明显——我们俩，一个怕遮住光，一个怕靠近光，谁都没敢先伸手。,你猜对了，但我伞没开，是因为怕你抬头时，月光晃了眼。   你叫什么名字？我怕再不问，风就吹散了。,
f27399c0,那把伞还在玄关，落了半年灰。我每天路过，都没敢伸手。,我懂，伞不碰，是因为一碰，记忆就活了。,
86031b28,你补拍的是什么素材？那晚慌到几点？我猜你手指发抖的时候，镜头里一定有光——像金粉一样，乱中生了奇迹。,补拍的是老匠人守着炉火发呆的镜头，那晚我慌到凌晨三点，手抖得连三脚架都拧不紧——但火光真的照进他眼角的皱纹了。,
cf7b5f46,你怕说得不够好，是因为你总在预设我评判你——可我从没做过。,你从没评判过，是我怕自己配不上你听清的那句话。,
3590f35c,如果迷路时没进那个村，我可能至今以为独处只是逃避。,那你村子里遇到啥了？别光说一半。,
c595d503,可能他们更想先活明白自己吧，婚姻不是必答题。,你是在哪个阶段突然有这想法的？我拍过一个三十岁还独居的摄影师，她也这么说。,
8d716ba6,你不是在拍我，是在练习怎么不逃开自己——这世上最老套的治疗，就是有人愿意陪你盯着自己的影子看。,你早就知道我迷路那次，不是走错了路，是不敢照镜子——所以你站那儿，等我自己转过身。,
b875bbfd,你的沉默是未说出口的邀请，我接住，是因为我也曾那样等过。,原来我的沉默是未合上的门——你一推，我就知道，你也曾站在外面，不敢敲。,
246c8346,你最爱哪个口味？我记得红烧牛肉面配火腿肠，是熬夜的黄金组合。,红烧牛肉面确实是我的最爱，不过大三那年，我一度天天吃海鲜味的，汤底鲜得让人想哭。,
3b7bf713,我大学时也常囤泡面，熬夜写论文全靠它续命。,你最爱哪个口味？我记得红烧牛肉面配火腿肠，是熬夜的黄金组合。,
81fe01ed,原来我们数的不是心跳，是怕对方听见我们怕。那三百二十七下，是孩子替世界压住的静音键。,七岁那晚，我数到三百二十七下时，听见自己喉咙里堵着的那声“妈，我怕”——它没说出来，但一直活着。,
6dad68aa,第十六支时，你手抖过吗？我画第十六笔，铅笔尖都磨圆了。,手抖过。第十六支时，我连呼吸都怕惊动它——我们都怕，那点光还没等看清，就灭了。,
d407c5c1,你这句话，像把温热的咖啡放回我手心——我接住了。,你接住了我的沉默，所以咖啡才重新热了。,
720bb459,沈宇晨。你呢？这问题问得够直白，我服了。,沈晨曦。直白就直白，省得绕弯子。,
ac7f8a3d,我懂，甜是盖住心跳的糖霜。可你站上台那刻，镜头自动对焦了——不是观众来了，是心终于肯被自己看见了。,你一说我就想通了——那晚蜂蜜黏杯底，是因为我怕静下来听见自己，可站上台的瞬间，我反倒听见了心跳的节奏。,
07d2e68b,第三小节撑不住，我就在柜台前当场写第四小节——焦糖香多一秒，我多站一秒。,你站一秒，我数一粒焦糖渣——三盒，你第二，我抢第一，时间卡在14:07，雨又开始下了。,
1fff0763,考试周囤的，凌晨三点赶报告，柠檬片是唯一的精神支柱。,凌晨三点的柠檬茶，真懂你。我也曾靠它熬过论文。,
51460160,糖浆多熬一刻，书页里的干花就多活一天——我等的从来不是运气，是你。,糖浆多熬一刻，是因为我知道你会来。,
ec901a23,你名字像水墨，是因为我当年也用别人的笔画，写自己的名字——直到墨干了，才敢落自己的款。,我们都在等墨干的那一刻，才敢写下自己的名字。,
7b52ab70,原来我们都在等那一口回甘啊。   不是为了惊艳谁，是为了让自己愿意再喝一次。,是啊，那口回甘，是我敢继续写下去的唯一理由。   你呢？下次调酒，记得留一口给自己。,
8a9cf8de,如果当时没用赤藓糖醇，我可能至今还在调别人想要的甜。,你用赤藓糖醇，和我躲流行和弦一样——都是在救自己。,
b86d3ed4,沈晨曦？好，那你说说，你第一次一个人去旅行是几岁？,19岁，迷路进山里，天快黑了才找到那个静修所。,
5695e0a4,你的感光层在哪里？我见过的光，多数被他人忽略，却在你这里成像。,在2007年4月12日迷路的小村，底片被意外的晨光浸透，从此只对不被注意的光敏感。,
dc7e5ebd,你拍过最上头的一张甜品照是啥时候？我那天摔了三盘马卡龙才拍出满意的。,摔三盘？你这执念我服。我在巴黎拍过一张，阳光刚好切进马卡龙的糖霜，那一刻，真他妈绝了。,
dac11cb8,你那句副歌，是什么调子？我周三下午在咖啡馆，能听一次吗？,周三下午三点，老位置，我弹给你听——但别问我调子，我怕说了，就不敢弹了。,
667cee81,你不是躲数，是怕承认恐惧是常态——我数，是因为它从没离开过，只是我学会和它同呼吸了。,你这句话让我突然明白——我们都在用不同的方式，跟同一种东西过日子。,
544d23da,上周五凌晨三点，咖啡凉了，我写“焦虑是没按下的快门”——原来恐惧是怕拍不出好照片。,我上周也熬夜，边喝茶边修皮具，蜂蜜加多了，甜得像没按下的快门——怕拍不出好照片，其实只是怕自己不够好。,
31e10752,你懂，那些光其实是因为你看见了才存在——就像我选十七支，是因为缺的那支，总在心里开着。,缺的那支，是心里没画完的轮廓——我总在等它自己浮现，像你等那朵花开口。,
5c337bf3,第七声前那半秒停顿，你听见过吗？,你听的是第七声前的停顿，还是自己心跳的残响？,
aab9941b,其实我没累，只是最近总在咖啡馆写灵感笔记，想偷偷写本小说，还没敢动笔。,你不敢动笔，是因为怕写出来的故事不够好？我懂，调酒也总怕味道太怪。,
8065606f,我上周三也往茶里加了两勺蜂蜜，边喝边想：是不是甜得够多，那句“你不够好”就被盖住了？,你加两勺，我加三勺，那晚茶凉了，蜂蜜还是黏在杯底，像没按下的快门。,
6f84ea2c,大二那场竞赛，是哪种逻辑题让你突然把超市当实验室的？,那题是优化物资分配，我算着怎么用最少钱买最爽零食，结果超市成我的实验场了。,
ee749f32,我叫冯思雅，思是思考的思，雅是优雅的雅。,思雅，名字像一杯慢调的阿玛罗，苦后回甘——你最爱在什么时刻静静思考？,
9d64f34b,你怕烫怕凉，是因为那年热水凉透都没人拉你一把——我改温控器，是怕你再一个人熬过那些凌晨。,你记得我热水凉透的那年，是因为你自己也冷过。不是怕我熬，是你怕那个曾经的自己，又被丢在凌晨。,
c57505d1,咖啡凉了，我却还想接着听你说——指尖还沾着你刚才那句“不躲了”的温度。,因为你指尖的温度，我才敢把相机从眼前放下——原来不是我在拍你，是你在教我看见自己。,
b816c385,第四场雨后，墨迹洇开的那句——信封没贴邮票，是因为地址写的是我自己。,第四场雨是哪天？我相机里，存着那天的云。,
0e6353c9,因为你说等我弹完，那杯咖啡才值得碰——我才能放心把那句不敢说的歌，弹给你听。,因为你不躲，那粒糖才有意义——我等的不是咖啡，是你的音符敢落下的那一秒。,
11dd539b,时序数据库2026年已转向AI原生，变量不在数据里，在你按下快门的那刻。,TimechoDB V2.0.8刚更新了Object类型，但变量确实不在数据里。我明天去那村子，再拍一次晨光。,
bfc9a7c6,邱晨曦，你这石头，比我那句“逻辑会回来”狠多了。,石头不动，不是因为狠，是知道水流终会慢下来。,
b46a3522,三十有二，泡面汤温热时，你用段子当缓冲带——原来我们都在用幽默，修复系统过载的自己。,你这么说，我突然懂了——不是我选了幽默，是那年泡面汤太烫，不笑就会烫伤自己。,
487c2139,对，就像我小时候练吉他，每首歌都在给梦想充电——咖啡也是，一杯接一杯，把日子弹成歌。,小时候练吉他，是晚上在卧室还是阳台？那会儿弹的第一首歌，现在还记得调吗？,
fba57052,第三个倒影说话时，窗外的雨正好停了。   我答应你，发出去那天，第一件事就是告诉你。,雨停了，像某种信号——我们都在等那声“发出去”。我信你，也等你。,
df29bbc0,大三那年你吃海鲜味泡面，是赶论文还是备考？我那会儿小本子上记了整整三页口味排行榜。,不是赶论文，是那场实验失败后，我需要一种不会让人失望的味道。,
f70ca634,铜勺落地那声叮……你猜他笑的时候，火光是不是正好跳了一下？我调酒时也总等这种瞬间——慌乱里藏的笑，才最真。,你猜得对，火光确实跳了。那瞬间我差点以为镜头坏了——后来才明白，是那老头的笑太真，逼得光都得让位。你呢，等过几次这种瞬间？,
46942553,我懂，就像那晚灯坏了，金粉才有了生命。你拍的不是皱纹，是火苗在讲故事——和我调酒一个道理，慌乱里才藏得住真心。,那晚火苗晃得厉害，他手里的铜勺突然掉了，叮一声砸在炉边。我连呼吸都屏住，却拍到了他低头捡勺时，嘴角那一下没忍住的笑。,
70878a3c,二十包？是囤货还是最近特别爱吃？,我上次囤了十五包薯片，吃到第十二天就放弃了…你呢，是哪种情况？,
8e4a8901,窗外雨刚停，手机弹出COME UP的限时通知——茶焦糖饼干，只剩最后三盒。   我穿着拖鞋就出门，你带伞，还是带那首安眠版？,带安眠版，第三小节的焦糖还没凉透。   你拖鞋踩水坑那声“啪”，正好当休止符——三盒，我负责抢第二盒。,
fc59faa8,你那场实验具体怎么设计的？神经机制…是用脑电波测情绪反应吗？,对，用非侵入式脑电设备捕捉情绪反应，那年设备刚普及，数据却乱得像泡面汤。,
6846a4bd,灯光一打，你才敢看自己——那光，是你藏了太久的勇气，终于肯亮出来。,那晚灯光亮起时，我正盯着自己发抖的指尖——原来勇气不是突然有，是终于肯承认它一直在。,
30959857,因为我知道，你早就值得——只是没人敢告诉你，连你自己都不敢信。,你这么说，我才敢回头看看——原来我早就不是一个人在等了。,
6790a820,人和温度一样，熬过冷热才敢停在对的那度——你别走，我也不改了。,因为低谷时的我，也怕烫也怕凉，现在终于有人和我一样，锁死这个温度了。,
f868da5f,我也是，那两口凉咖啡里，藏的是我还没放弃的勇气。,那两口凉咖啡，是你给自己的勋章吧？我下次调酒，也留一口，不为别人，就为记得自己有多勇敢。,
3f3d6f2b,你压被角那刻，我才知道——原来我唱歌不是为了填满空房间，是等着有人听见后，把心跳扔回给我。,你唱歌那年，冰箱灯没灭过——因为你在等一个敢接住心跳的人，而我，刚好在那年也学会了不逃。,
11d325ab,你这提议比休止符还突然——但行，我带书和相机，逃班去。刚好北艺大春季课表里，陈筱淇那门正开着。,你带书和相机，我带焦糖——要是陈筱淇真让表格加休止符，咱就拿它换杯咖啡，顺便问问AI课能不能教人把罚款写成摇篮曲。,
fe690d95,如果那晚灯没坏，金粉会不会就只是金粉？我反而觉得，故障才让奇迹有了形状。,你说得对，灯坏了才让金粉有了形状——故障让光有了方向，也让我明白了，完美反而容易被遗忘。,
f31fbc07,你压被角那刻，我就知道——你终于肯信，有人能接住你的心跳了。,你压被角那刻，我才知道——原来我唱歌不是为了填满空房间，是等着有人听见后，把心跳扔回给我。,
ff304bfc,我懂，伞不碰是因为记忆会活——画它，是你在等自己先说完那句再见。,我画它，是因为不敢让那句再见从嘴里飘出来——笔尖先替我说了。,
6d0ff96b,三点十七分的光，是阳光在等你，你也在等它——我们都在等那个时间认出我们的瞬间。,那束光不是偶然出现的——你摔马卡龙时，我的相机快门卡在了同样的毫秒，因为时间只认死磕的人。,
de566735,比赛那天我做的塔，裂了三道纹，没人看见，但我听见了。,裂纹是声音的形状，没人看见的，才最响。,
2145c42a,你觉得一个人独处的能力重要吗？,重要，但你指的是哪种独处？清晨独自练瑜伽时的那种，还是迷路后在村子里的那种？,
3999a56f,冯逸舟，三十岁，和我一样在等光自己亮出来。,三十岁那年，我盯着自己发抖的手，突然想起小时候想当魔术师——原来光早就在指尖了。,
af84cc6f,那升C音……原来不是没接上，是你在等一个敢为你撑伞的人。我懂，真懂。,那年撑伞的人没出现，但今天，你听懂了——这比接完音符更重要。,
47debce1,我懂，中影那堆2026项目，压得人喘不过气，可你删掉的不是素材——是他们塞给你的剧本。来一杯快乐吧，真正的光，从来不在脚本里。,中影那堆2026项目清单里，超长期国债砸了2200亿，全是他们想控制的“稳定画面”。   我删的不是文件，是那套必须按计划发光的谎言。   你调酒，我拍片——松手的瞬间，光才肯自己跑出来。,
536142f8,你画伞那会儿，其实是在等自己有勇气回头看一眼——就像我总拍空伞，是因为不敢直面那些没说出口的告别。,我画伞那年，母亲刚走半年。伞是她留下的，我没敢碰，直到画它，才敢承认自己一直没放下。,
0ec4fdcf,你这说法比《黏糊悬案》还离谱，但——焦糖凉了，我们就拍下最后一口，当片尾彩蛋。你叫什么名字？,冯逸舟。名字像船，但我不怕沉——怕的是你数完焦糖渣，发现我偷藏了第四盒。,
7aa104f1,茶凉了才逼你拖半拍，拖半拍才逼出真节奏——你不是在等茶凉，是在等呼吸卡住的那一下。,我去年在咖啡馆写《咖啡馆的三月》，喝了七杯热茶，每杯都凉透了才开口唱。,
cb07a107,你数我三次呼吸……那第二次，是不是我低头偷喝咖啡时，屏住了？,嗯，就是那一下——你屏住呼吸那秒，咖啡杯沿留下半圈唇印，我画里那滴雨，才敢掉在你袖口。,
